{"type":"config","name":"PiDrive Codebase Quality Optimization","metricName":"issue_count","metricUnit":"","bestDirection":"lower"}
{"run":1,"commit":"db6cb34","metric":1,"metrics":{"binary_kb":9236,"build_ms":307},"status":"keep","description":"Baseline: 1 static analysis issue, 9236KB binary, 307ms build","timestamp":1773962069824,"segment":0,"confidence":null}
{"run":2,"commit":"f3e0a6b","metric":0,"metrics":{"binary_kb":9236,"build_ms":316},"status":"keep","description":"Fix unused err in indexer.go - proper error logging for db.Exec","timestamp":1773962093663,"segment":0,"confidence":null}
{"run":3,"commit":"57d31f7","metric":0,"metrics":{"binary_kb":9236,"build_ms":315},"status":"keep","description":"gofmt formatting fixes in sftpd/handler.go","timestamp":1773962128934,"segment":0,"confidence":null}
{"run":4,"commit":"a08123d","metric":0,"metrics":{"binary_kb":9236,"build_ms":323,"deadcode":33,"loc":6201},"status":"keep","description":"Add deadcode and loc tracking to benchmark","timestamp":1773962228957,"segment":0,"confidence":null}
{"run":5,"commit":"07edac7","metric":0,"metrics":{"binary_kb":9236,"build_ms":301,"deadcode":16,"loc":5885},"status":"keep","description":"Remove unused sftpd package - deadcode 33→16, loc 6201→5885","timestamp":1773962248663,"segment":0,"confidence":null}
{"run":6,"commit":"a306b5f","metric":0,"metrics":{"binary_kb":9236,"build_ms":352,"deadcode":11,"loc":5772},"status":"keep","description":"Remove unused mount helper functions - deadcode 16→11, loc 5885→5772","timestamp":1773962346407,"segment":0,"confidence":null}
{"run":7,"commit":"d0bab90","metric":0,"metrics":{"binary_kb":9236,"build_ms":363,"deadcode":11,"loc":5853},"status":"keep","description":"Add auth unit tests for GenerateAPIKey, VerificationCode, HashAPIKey","timestamp":1773962415428,"segment":0,"confidence":null}
{"run":8,"commit":"ed9b270","metric":0,"metrics":{"binary_kb":9236,"build_ms":303,"deadcode":11,"loc":5924},"status":"keep","description":"Add share and parseDuration tests","timestamp":1773962469096,"segment":0,"confidence":null}
{"run":9,"commit":"0a54a35","metric":0,"metrics":{"binary_kb":6388,"build_ms":239,"deadcode":11,"loc":5924},"status":"keep","description":"Add LDFLAGS=-s -w to Makefile and benchmark for 31% smaller binaries","timestamp":1773962564427,"segment":0,"confidence":null}
{"run":10,"commit":"417020b","metric":0,"metrics":{"binary_kb":6388,"build_ms":566,"deadcode":11,"loc":5928},"status":"keep","description":"Add godoc comments to helpers.go","timestamp":1773962597963,"segment":0,"confidence":null}
{"run":11,"commit":"5c55299","metric":0,"metrics":{"binary_kb":6388,"build_ms":241,"deadcode":11,"loc":5933},"status":"keep","description":"Add godoc comments to middleware.go","timestamp":1773962624818,"segment":0,"confidence":null}
{"run":12,"commit":"4139526","metric":0,"metrics":{"binary_kb":6388,"build_ms":249,"deadcode":11,"loc":6026},"status":"keep","description":"Add config package unit tests for Load, envOr, envIntOr","timestamp":1773962676046,"segment":0,"confidence":null}
{"run":13,"commit":"26b109c","metric":0,"metrics":{"binary_kb":6388,"build_ms":242,"deadcode":11,"loc":6064},"status":"keep","description":"Add search package tests for indexable extensions and max file size","timestamp":1773962700382,"segment":0,"confidence":null}
{"run":14,"commit":"b8cf871","metric":0,"metrics":{"binary_kb":6388,"build_ms":240,"deadcode":11,"loc":6167},"status":"keep","description":"Add rate limiter and getClientIP tests","timestamp":1773962746333,"segment":0,"confidence":null}
{"run":15,"commit":"4002a4e","metric":0,"metrics":{"binary_kb":6388,"build_ms":247,"deadcode":11,"loc":6291},"status":"keep","description":"Add WebDAV filesystem tests for cleanPath, isSharedPath, virtualDir, dirInfo","timestamp":1773962801118,"segment":0,"confidence":null}
{"run":16,"commit":"a47f271","metric":0,"metrics":{"binary_kb":6388,"build_ms":241,"deadcode":11,"loc":6291},"status":"keep","description":"Update autoresearch.ideas.md with completed optimizations","timestamp":1773962839141,"segment":0,"confidence":null}
{"run":17,"commit":"690f423","metric":0,"metrics":{"binary_kb":6388,"build_ms":257,"deadcode":11,"loc":6379},"status":"keep","description":"Add CLI client tests for credentialsPath, MountPath, Server","timestamp":1773962873865,"segment":0,"confidence":null}
{"run":18,"commit":"c6b94eb","metric":0,"metrics":{"binary_kb":6388,"build_ms":253,"deadcode":11,"loc":6412},"status":"keep","description":"Add formatBytes unit test for CLI byte formatting","timestamp":1773962923679,"segment":0,"confidence":null}
{"type":"config","name":"PiDrive Dead Code Reduction","metricName":"deadcode","metricUnit":"","bestDirection":"lower"}
{"run":19,"commit":"6b152cb","metric":11,"metrics":{},"status":"keep","description":"Baseline for deadcode-focused session: 11 unreachable funcs, issue_count 0, 6388KB binary, 682ms build","timestamp":1774503309870,"segment":1,"confidence":null}
{"run":20,"commit":"180b644","metric":0,"metrics":{},"status":"keep","description":"Remove unreachable WebDAV invalidation helper, unused auth/billing methods, and obsolete mount service package to cut deadcode 11→0 while preserving issue_count 0","timestamp":1774503388801,"segment":1,"confidence":null}
{"type":"config","name":"PiDrive CLI Binary Size Reduction","metricName":"binary_kb","metricUnit":"kb","bestDirection":"lower"}
{"run":21,"commit":"7778181","metric":6388,"metrics":{},"status":"keep","description":"Baseline for binary-size session: stripped CLI binary 6388KB, build 546ms, issue_count 0, deadcode 0","timestamp":1774503457352,"segment":2,"confidence":null}
{"run":22,"commit":"dffc7da","metric":6172,"metrics":{},"status":"keep","description":"Replace TOML dependency in cli/client.go with a tiny stdlib credentials parser/encoder, reducing stripped CLI binary 6388KB→6172KB and build time 546ms→515ms while keeping issue_count 0 and deadcode 0","timestamp":1774503552046,"segment":2,"confidence":null}
{"run":23,"commit":"b26190b","metric":5696,"metrics":{},"status":"keep","description":"Replace Cobra-based CLI dispatch with stdlib flag parsing across cli/*.go and prune stale ideas backlog, reducing stripped binary 6172KB→5696KB while preserving issue_count 0 and deadcode 0","timestamp":1774503821095,"segment":2,"confidence":3.2037037037037037}
{"run":24,"commit":"b26190b","metric":5696,"metrics":{},"status":"discard","description":"Tried splitting mount/default-path logic into platform-specific build-tag files to exclude non-Darwin code from the CLI binary; build time improved to 290ms but binary_kb stayed flat at 5696, so discard as no primary-metric gain","timestamp":1774503974260,"segment":2,"confidence":2.907563025210084}
{"type":"config","name":"PiDrive CLI Build Time Reduction","metricName":"build_ms","metricUnit":"ms","bestDirection":"lower"}
{"run":25,"commit":"95f0321","metric":644,"metrics":{},"status":"keep","description":"Baseline for build-time session: 644ms build, 5696KB stripped binary, issue_count 0, deadcode 0","timestamp":1774505775462,"segment":3,"confidence":null}
{"run":26,"commit":"a275e3a","metric":482,"metrics":{},"status":"keep","description":"Split mount and default-mount-path logic into platform-specific build-tag files so Darwin CLI builds exclude Linux-only code, improving build time 644ms→482ms while keeping binary_kb 5696 and issue_count 0","timestamp":1774543888407,"segment":3,"confidence":null}
{"run":27,"commit":"a275e3a","metric":5229,"metrics":{},"status":"discard","description":"Noise-check rerun of current build-time winner on clean cache conditions came back at 5229ms versus prior 482ms, showing build_ms is extremely noisy/cache-sensitive; discard measurement and avoid overfitting future tweaks to single-run build timings","timestamp":1774544422770,"segment":3,"confidence":1}
{"type":"config","name":"PiDrive CLI Binary Size Reduction Round 2","metricName":"binary_kb","metricUnit":"kb","bestDirection":"lower"}
{"run":28,"commit":"92740c7","metric":5696,"metrics":{},"status":"keep","description":"Baseline for second binary-size session after Darwin build-tag split: 5696KB stripped binary, 495ms build, issue_count 0, deadcode 0","timestamp":1774544462967,"segment":4,"confidence":null}
{"run":29,"commit":"8093a73","metric":5660,"metrics":{},"status":"keep","description":"Replace stdlib flag.FlagSet usage with a tiny custom CLI arg parser in cli/args.go and prune tried ideas, reducing stripped binary 5696KB→5660KB while preserving issue_count 0 and deadcode 0","timestamp":1774544711604,"segment":4,"confidence":null}
{"run":30,"commit":"8093a73","metric":5660,"metrics":{},"status":"discard","description":"Tried collapsing Client Get/Post/Delete/doRequest/parseResponse into a single RequestJSON helper to reduce wrapper code, but stripped binary stayed flat at 5660KB despite faster build timing, so discard as no primary-metric gain","timestamp":1774544840089,"segment":4,"confidence":null}
{"run":31,"commit":"8093a73","metric":5660,"metrics":{},"status":"discard","description":"Tried removing the bytes package from cli/client.go by switching readers to strings.NewReader; binary_kb stayed flat at 5660, so discard. Added a follow-up idea to test full fmt removal since piecemeal stdlib-package removals are not moving the needle","timestamp":1774544902221,"segment":4,"confidence":null}
{"run":32,"commit":"8093a73","metric":5660,"metrics":{},"status":"discard","description":"Tried simplifying search/activity output formatting to avoid fmt-heavy Printf/Println paths in the largest CLI handlers, but stripped binary stayed at 5660KB; discard and treat fmt-removal as only worth pursuing package-wide, not piecemeal","timestamp":1774544983151,"segment":4,"confidence":null}
